{
  "name": "Cartosat-1 DEM (CartoDEM v3 R1)",
  "source": "NRSC / ISRO — CartoDEM",
  "url": "https://bhuvan.nrsc.gov.in/bhuvan_links.php#",
  "geography": "India (complete national coverage)",
  "date": "2016 (v3 R1); updated tiles available",
  "resolution": "30m spatial resolution; ~8m vertical accuracy (open terrain)",
  "crs": "EPSG:4326 (WGS84), heights in EGM96 geoid",
  "labels": "Terrain elevation only (DTM). No building labels.",
  "license": "NRSC data policy. Free for research; registration required at Bhuvan portal.",
  "provenance": "Available via Bhuvan Geoportal DEM downloads section after user registration.",
  "status": "REAL",
  "limitations": "HISTORICAL METADATA ONLY — NOT USED FOR TRAINING/VALIDATION/PRODUCTION INFERENCE. 30m resolution insufficient for individual building height estimation. Not hosted on open data.gov.in portal.",
  "intended_use": "HISTORICAL METADATA ONLY — NOT USED FOR TRAINING/VALIDATION/PRODUCTION INFERENCE. Authorized datasets must originate from data.gov.in or official state/UT portals."
}